{
 "$schema": "../kit/core/schema/house.schema.json",
 "version": 1,
 "meta": {
  "name": "The Larch \u00b7 3 bed 2 bath",
  "fictional": true,
  "label": "Fictional sample house \u00b7 not a real property",
  "units": "m",
  "source_plan": "sample-plan.png",
  "stated_area_m2": 140.4,
  "stated_area_sqft": 1511,
  "stated_area_basis": "gross, to the outside face of exterior walls",
  "north_deg": 0,
  "notes": "Single storey, 14.25 x 9.85 m outside. Coordinates are wall centrelines, metres, origin at the north-west wall centreline corner, y runs down the plan (south)."
 },
 "defaults": {
  "wall_height": 2.7,
  "wall_thickness": 0.12,
  "exterior_wall_thickness": 0.25,
  "eye_height": 1.6,
  "floor": "oak_floor",
  "wall": "cream_wall",
  "ceiling": "white_ceiling"
 },
 "materials": {
  "oak_floor": {
   "color": "#bf9d74",
   "roughness": 0.5,
   "pattern": "planks",
   "plank_width": 0.19,
   "plank_length": 1.4
  },
  "bath_floor": {
   "color": "#c9c4bc",
   "roughness": 0.35,
   "pattern": "tiles",
   "tile_size_m": 0.6,
   "grout_color": "#b5afa6"
  },
  "bath_wall": {
   "color": "#efede9",
   "roughness": 0.22,
   "pattern": "tiles",
   "tile_size_m": [
    0.3,
    0.6
   ],
   "stagger": true,
   "grout_color": "#dad6cf"
  },
  "bedroom_carpet": {
   "color": "#cdbfa9",
   "roughness": 1,
   "pattern": "carpet"
  },
  "sage": {
   "color": "#7d8b78",
   "roughness": 0.5
  },
  "walnut": {
   "color": "#7a5a43",
   "roughness": 0.55
  },
  "oatmeal_fabric": {
   "color": "#b9b0a1",
   "roughness": 0.95,
   "pattern": "fabric"
  },
  "slate_fabric": {
   "color": "#6f747a",
   "roughness": 0.95,
   "pattern": "fabric"
  }
 },
 "render": {
  "sun_azimuth_deg": 215,
  "sun_elevation_deg": 30,
  "sun_intensity": 2.6,
  "env_intensity": 0.6,
  "hemi_intensity": 0.65,
  "exposure": 1.0
 },
 "levels": [
  {
   "id": "L1",
   "name": "Ground floor",
   "elevation": 0,
   "height": 2.7,
   "rooms": [
    {
     "id": "kitchen",
     "name": "Kitchen",
     "polygon": [
      [
       0,
       0
      ],
      [
       6.4,
       0
      ],
      [
       6.4,
       4.4
      ],
      [
       0,
       4.4
      ]
     ]
    },
    {
     "id": "living",
     "name": "Living / Dining",
     "polygon": [
      [
       0,
       4.4
      ],
      [
       6.4,
       4.4
      ],
      [
       6.4,
       9.6
      ],
      [
       0,
       9.6
      ]
     ]
    },
    {
     "id": "bed2",
     "name": "Bedroom 2",
     "polygon": [
      [
       6.4,
       0
      ],
      [
       9.4,
       0
      ],
      [
       9.4,
       3.9
      ],
      [
       6.4,
       3.9
      ]
     ],
     "floor": "bedroom_carpet"
    },
    {
     "id": "bath",
     "name": "Bathroom",
     "polygon": [
      [
       9.4,
       0
      ],
      [
       11.3,
       0
      ],
      [
       11.3,
       3.9
      ],
      [
       9.4,
       3.9
      ]
     ],
     "floor": "bath_floor",
     "wall": "bath_wall"
    },
    {
     "id": "bed3",
     "name": "Bedroom 3",
     "polygon": [
      [
       11.3,
       0
      ],
      [
       14,
       0
      ],
      [
       14,
       3.9
      ],
      [
       11.3,
       3.9
      ]
     ],
     "floor": "bedroom_carpet"
    },
    {
     "id": "hall",
     "name": "Entry / Hall",
     "polygon": [
      [
       6.4,
       3.9
      ],
      [
       14,
       3.9
      ],
      [
       14,
       5.1
      ],
      [
       8.0,
       5.1
      ],
      [
       8.0,
       9.6
      ],
      [
       6.4,
       9.6
      ]
     ],
     "label_at": [
      11.3,
      4.5
     ]
    },
    {
     "id": "ensuite",
     "name": "Ensuite",
     "polygon": [
      [
       8.0,
       5.1
      ],
      [
       10.2,
       5.1
      ],
      [
       10.2,
       7.5
      ],
      [
       8.0,
       7.5
      ]
     ],
     "floor": "bath_floor",
     "wall": "bath_wall"
    },
    {
     "id": "wic",
     "name": "Walk-in robe",
     "polygon": [
      [
       8.0,
       7.5
      ],
      [
       10.2,
       7.5
      ],
      [
       10.2,
       9.6
      ],
      [
       8.0,
       9.6
      ]
     ],
     "floor": "bedroom_carpet"
    },
    {
     "id": "primary",
     "name": "Primary bedroom",
     "polygon": [
      [
       10.2,
       5.1
      ],
      [
       14,
       5.1
      ],
      [
       14,
       9.6
      ],
      [
       10.2,
       9.6
      ]
     ],
     "floor": "bedroom_carpet"
    }
   ],
   "walls": [
    {
     "id": "ext-n",
     "a": [
      0,
      0
     ],
     "b": [
      14,
      0
     ],
     "exterior": true
    },
    {
     "id": "ext-e",
     "a": [
      14,
      0
     ],
     "b": [
      14,
      9.6
     ],
     "exterior": true
    },
    {
     "id": "ext-s",
     "a": [
      14,
      9.6
     ],
     "b": [
      0,
      9.6
     ],
     "exterior": true
    },
    {
     "id": "ext-w",
     "a": [
      0,
      9.6
     ],
     "b": [
      0,
      0
     ],
     "exterior": true
    },
    {
     "id": "w-great",
     "a": [
      6.4,
      0
     ],
     "b": [
      6.4,
      9.6
     ]
    },
    {
     "id": "w-hall-n",
     "a": [
      6.4,
      3.9
     ],
     "b": [
      14,
      3.9
     ]
    },
    {
     "id": "w-n1",
     "a": [
      9.4,
      0
     ],
     "b": [
      9.4,
      3.9
     ]
    },
    {
     "id": "w-n2",
     "a": [
      11.3,
      0
     ],
     "b": [
      11.3,
      3.9
     ]
    },
    {
     "id": "w-hall-s",
     "a": [
      8.0,
      5.1
     ],
     "b": [
      14,
      5.1
     ]
    },
    {
     "id": "w-foyer",
     "a": [
      8.0,
      5.1
     ],
     "b": [
      8.0,
      9.6
     ]
    },
    {
     "id": "w-mid",
     "a": [
      10.2,
      5.1
     ],
     "b": [
      10.2,
      9.6
     ]
    },
    {
     "id": "w-ens",
     "a": [
      8.0,
      7.5
     ],
     "b": [
      10.2,
      7.5
     ]
    }
   ],
   "openings": [
    {
     "id": "win-kitchen",
     "wall": "ext-n",
     "type": "window",
     "offset": 3.2,
     "width": 1.6,
     "sill": 1.05,
     "height": 1.05,
     "curtains": false
    },
    {
     "id": "win-bed2",
     "wall": "ext-n",
     "type": "window",
     "offset": 7.9,
     "width": 1.4,
     "sill": 0.9,
     "height": 1.3
    },
    {
     "id": "win-bath",
     "wall": "ext-n",
     "type": "window",
     "offset": 10.35,
     "width": 0.6,
     "sill": 1.5,
     "height": 0.6,
     "frosted": true
    },
    {
     "id": "win-bed3",
     "wall": "ext-n",
     "type": "window",
     "offset": 12.65,
     "width": 1.4,
     "sill": 0.9,
     "height": 1.3
    },
    {
     "id": "win-hall",
     "wall": "ext-e",
     "type": "window",
     "offset": 4.5,
     "width": 0.7,
     "sill": 0.9,
     "height": 1.3,
     "curtains": false
    },
    {
     "id": "win-primary",
     "wall": "ext-s",
     "type": "window",
     "offset": 1.9,
     "width": 1.8,
     "sill": 0.8,
     "height": 1.4
    },
    {
     "id": "door-front",
     "wall": "ext-s",
     "type": "door",
     "offset": 6.8,
     "width": 0.92,
     "height": 2.1,
     "exterior_door": true,
     "color": "#3f4a4f",
     "hinge": "a",
     "swing": "+"
    },
    {
     "id": "slider-living",
     "wall": "ext-s",
     "type": "sliding",
     "offset": 10.8,
     "width": 2.4,
     "height": 2.1
    },
    {
     "id": "win-living",
     "wall": "ext-w",
     "type": "window",
     "offset": 4.2,
     "width": 1.4,
     "sill": 0.9,
     "height": 1.3
    },
    {
     "id": "win-kitchen-w",
     "wall": "ext-w",
     "type": "window",
     "offset": 7.2,
     "width": 1.2,
     "sill": 0.9,
     "height": 1.3
    },
    {
     "id": "open-hall",
     "wall": "w-great",
     "type": "opening",
     "offset": 4.5,
     "width": 1.0,
     "height": 2.1
    },
    {
     "id": "open-foyer",
     "wall": "w-great",
     "type": "opening",
     "offset": 7.2,
     "width": 1.2,
     "height": 2.1
    },
    {
     "id": "door-bed2",
     "wall": "w-hall-n",
     "type": "door",
     "offset": 2.3,
     "width": 0.82,
     "hinge": "b",
     "swing": "-"
    },
    {
     "id": "door-bath",
     "wall": "w-hall-n",
     "type": "door",
     "offset": 3.95,
     "width": 0.76,
     "hinge": "b",
     "swing": "-"
    },
    {
     "id": "door-bed3",
     "wall": "w-hall-n",
     "type": "door",
     "offset": 5.5,
     "width": 0.82,
     "hinge": "a",
     "swing": "-"
    },
    {
     "id": "door-primary",
     "wall": "w-hall-s",
     "type": "door",
     "offset": 2.9,
     "width": 0.82,
     "hinge": "a",
     "swing": "+"
    },
    {
     "id": "door-ensuite",
     "wall": "w-mid",
     "type": "door",
     "offset": 1.2,
     "width": 0.76,
     "hinge": "b",
     "swing": "-"
    },
    {
     "id": "open-wic",
     "wall": "w-mid",
     "type": "opening",
     "offset": 3.45,
     "width": 0.76,
     "height": 2.04
    }
   ],
   "furniture": [
    {
     "id": "kitchen-run",
     "type": "counter",
     "room": "kitchen",
     "position": [
      2.5625,
      0.435
     ],
     "facing": "S",
     "size": [
      4.875,
      0.62,
      0.9
     ],
     "sink_at": 3.075,
     "cooktop_at": 1.175,
     "uppers": true,
     "upper_gaps": [
      [
       2.15,
       4.0
      ]
     ]
    },
    {
     "id": "fridge",
     "type": "fridge",
     "room": "kitchen",
     "position": [
      5.47,
      0.475
     ],
     "facing": "S",
     "size": [
      0.9,
      0.7,
      1.85
     ]
    },
    {
     "id": "pantry",
     "type": "cabinet",
     "room": "kitchen",
     "position": [
      6.12,
      0.435
     ],
     "facing": "S",
     "size": [
      0.42,
      0.62,
      2.25
     ]
    },
    {
     "id": "island",
     "type": "island",
     "room": "kitchen",
     "position": [
      2.8,
      2.45
     ],
     "facing": "S",
     "size": [
      2.4,
      1.05,
      0.92
     ],
     "color": "#7d8b78",
     "stools": 3,
     "accent": "#7a5a43"
    },
    {